{
  "schema_version": "2.0-rc1",
  "issue_id": "2026-W43",
  "research_profile": "WEEKLY",
  "basis": {
    "production_profile_sha256": "4447d25ea73ab76062028e63f91065f80c9b93886a542356c50ae54bfb10b5af",
    "profile_completeness_sha256": "77841fd29e25d426a76e1c47e611c8026ff3ed5c27cfd89cb3c1307eb8e5da97",
    "materiality_ledger_sha256": "c4953bc81774082435a3f84159bc58cbc91819709934b6d8d9f72661427aeaae",
    "evidence_acceptance_sha256": "4a5a3feda1a1d3d960684a954550100376b1fda8393b6bb4c262a03ca1b1fcdd",
    "edition_views_acceptance_sha256": "5526e06a5b8310db37d9926c81a6776e09b86c7d85e84b4df4524edf9634831b"
  },
  "rows": [
    {
      "candidate_id": "candidate:2026-W43:98f3617da0de4365",
      "evidence_task_id": "evidence:2026-W43:0186d12abaa2b682",
      "discovery_ids": [
        "w43-primary-kimi-20261023"
      ],
      "evidence_sha256": "e791d9cb44603d057b2dc3bb0b8705cd80d65f7e8a93a445f8bf0bb5e2d60eb8",
      "edition_view_sha256": "1dcc6a24751ecdba784914d7b8958aaf41cec397c45fdf69663a075307325636",
      "title": "Moonshot Kimi K3.1 Pro",
      "artifact_type": "MODEL",
      "evidence_status": "PARTIAL",
      "materiality": "MATERIAL",
      "scope_dimensions": [
        "current relevance",
        "technical significance"
      ],
      "comparison": {
        "source_count": 2,
        "claim_count": 4,
        "metric_count": 0,
        "limitation_count": 3,
        "unresolved_question_count": 3,
        "contradiction_count": 0,
        "entity_count": 1
      },
      "remaining_boundaries": [
        "Weights unavailable until Nov 4: no local run or hash verification",
        "2.8T/104B X-only; blog says 3T-class — must not cite blog for 2.8T/104B",
        "Vendor harnesses/denominators; API pricing != weight-license terms",
        "weights-release-by-Nov-4: Weights promised Nov 4 FUTURE; not published at observation.",
        "independent-local-run: No local run before weights; early API/AA vendor-/third-party-reported.",
        "cyber-removal-scope: Removal described; independent scope unconfirmed."
      ],
      "profile_extensions": {
        "why_this_issue": "Late-window open-weight frontier (X 17:15:24Z IN; blog day-only, weights Nov 4 FUTURE): novelty high with weight-unavailable and harness limits; W43 membership rests on X event, not blog midnight. [CLOCK note; no selection implied.]",
        "window_relation": "MAIN_EVENT",
        "carry_over": false
      }
    },
    {
      "candidate_id": "candidate:2026-W43:1d7d93a70eeabd2b",
      "evidence_task_id": "evidence:2026-W43:0574663ab3a2123e",
      "discovery_ids": [
        "w43-lead-oracle-revision-20261021"
      ],
      "evidence_sha256": "c27f1bda18fddcb0351b550846048119c2fb446bb124e1ca34a070d6b5fe059f",
      "edition_view_sha256": "597e96a6f3e6e687d1558f822476731c8dd2406b332912eee2ad0217f7495001",
      "title": "Agent-eval oracle integrity audit (2610.16067v2)",
      "artifact_type": "PAPER",
      "evidence_status": "PARTIAL",
      "materiality": "CONTEXT",
      "scope_dimensions": [
        "technical significance"
      ],
      "comparison": {
        "source_count": 2,
        "claim_count": 3,
        "metric_count": 0,
        "limitation_count": 1,
        "unresolved_question_count": 1,
        "contradiction_count": 0,
        "entity_count": 1
      },
      "remaining_boundaries": [
        "Full 29pp body beyond abs+intro unread; v1-to-v2 delta unchecked; paper claims unreproduced here",
        "v1-v2-substantive-delta: v2 revision verified as event; substantive delta vs v1 unchecked."
      ],
      "profile_extensions": {
        "why_this_issue": "Oracle v1 Oct12 OUT vs v2 Oct21 04:47:46Z IN (261750B): revision event only; 5 invariants + 3 controls + 7 defect classes + 54/57 combos + 4194/2883 + 94.3->65.5% + 24-34pt + 3240-episode ablation read at abs/intro level; full v1->v2 diff (38pp + eval/ablation) NOT line-reviewed; must not promote OUT v1 as W43 discovery. CONTEXT bibliography. [r3 IA-010 UNRESOLVED_DEFERRED_WITH_RATIONALE; no selection implied.]",
        "window_relation": "MAIN_EVENT",
        "carry_over": false
      }
    },
    {
      "candidate_id": "candidate:2026-W43:55f087dd70eb920c",
      "evidence_task_id": "evidence:2026-W43:0714ceb7b0ee82be",
      "discovery_ids": [
        "w43-r4-grok-x-ledger-20261024"
      ],
      "evidence_sha256": "bc1c31b4c086cbafd0e9e5140d3cd7adb21ece642debc40da85249466bb5bccb",
      "edition_view_sha256": "c1069fd0863030b550e59a66ff0b6f4385f04b609599b13a692baa2dc68817dd",
      "title": "Grok X weekly intake ledger",
      "artifact_type": "OTHER",
      "evidence_status": "PARTIAL",
      "materiality": "NON_MATERIAL",
      "scope_dimensions": [
        "current relevance"
      ],
      "comparison": {
        "source_count": 1,
        "claim_count": 2,
        "metric_count": 0,
        "limitation_count": 3,
        "unresolved_question_count": 1,
        "contradiction_count": 0,
        "entity_count": 1
      },
      "remaining_boundaries": [
        "X observation PARTIAL; most topic claims lack exact post IDs",
        "Binder NON_MATERIAL NEVER_STORY; Selection body material prohibited",
        "Source-type inflation prohibited; no authority manipulation",
        "independent-repro-status: No independent X-claim reproduction; sensor only."
      ],
      "profile_extensions": {
        "why_this_issue": "Audit sensor binder (COMPLETE registration, PARTIAL observation, 2 pinned IDs): NON_MATERIAL NEVER_STORY; projection inflation prohibited. [r3 IA-014 fix; no selection implied.]",
        "window_relation": "OTHER",
        "carry_over": false
      }
    },
    {
      "candidate_id": "candidate:2026-W43:b26dfd2c2e5ac943",
      "evidence_task_id": "evidence:2026-W43:2223bd7df5bb3a3b",
      "discovery_ids": [
        "w43-r2-moss-trainer-20261018"
      ],
      "evidence_sha256": "931ad39ed01b47dad35aab0cf41d9d150312515bbd9005559269fdfbfcfd5842",
      "edition_view_sha256": "cb184ea2ba5a50b9ea87642be59059e16d2a1180a8279965aa878400a987ec05",
      "title": "KohakuMossTrainer",
      "artifact_type": "FRAMEWORK",
      "evidence_status": "PARTIAL",
      "materiality": "MATERIAL",
      "scope_dimensions": [
        "current relevance",
        "technical significance"
      ],
      "comparison": {
        "source_count": 2,
        "claim_count": 2,
        "metric_count": 0,
        "limitation_count": 3,
        "unresolved_question_count": 1,
        "contradiction_count": 0,
        "entity_count": 1
      },
      "remaining_boundaries": [
        "Third-party implementation; no independent GPU/VRAM rerun",
        "Custom license; commercial/redistribution terms per license text only",
        "MOSS Base Oct16 OUT vs trainer Oct18 IN distinguished; API/report events separate",
        "kernel-and-vram-claims: GRAD_ACC/VRAM/scratch figures author-measured; independent measurement absent."
      ],
      "profile_extensions": {
        "why_this_issue": "Third-party training efficiency report (host-accumulator VRAM path) with custom-license boundary: moderate tooling relevance with author-measurement and license limits. [r3 IA-012 fix; no selection implied.]",
        "window_relation": "MAIN_EVENT",
        "carry_over": false
      }
    },
    {
      "candidate_id": "candidate:2026-W43:b87e32087dcd83a7",
      "evidence_task_id": "evidence:2026-W43:29dd9729d8676386",
      "discovery_ids": [
        "w43-r2-moss-report-announce-20261019"
      ],
      "evidence_sha256": "1c87b4d279661edcd22896f35139554f650efeb1c996a34cb2eba91c8956b052",
      "edition_view_sha256": "734c3989fd682f8989ce94748c0bf46dceb787c84c4a9ab070e216d408c711b6",
      "title": "MOSS-Image technical report arXiv announcement",
      "artifact_type": "PAPER",
      "evidence_status": "PARTIAL",
      "materiality": "CONTEXT",
      "scope_dimensions": [
        "current relevance"
      ],
      "comparison": {
        "source_count": 1,
        "claim_count": 2,
        "metric_count": 0,
        "limitation_count": 2,
        "unresolved_question_count": 1,
        "contradiction_count": 0,
        "entity_count": 1
      },
      "remaining_boundaries": [
        "Report body Oct16 OUT; announcement IN; substantive v1->v2 delta if any unchecked",
        "Platform availability unproven beyond README line",
        "report-pdf-body: Body Oct16 OUT; announcement Oct19 IN; new-research promotion prohibited."
      ],
      "profile_extensions": {
        "why_this_issue": "Bibliographic announcement (Oct16 body OUT, Oct19 announce IN): CONTEXT bibliography, never story; event-type split preserved. [r3 IA-013 fix; no selection implied.]",
        "window_relation": "MAIN_EVENT",
        "carry_over": false
      }
    },
    {
      "candidate_id": "candidate:2026-W43:e4b1869996b82b4a",
      "evidence_task_id": "evidence:2026-W43:35f6d2e0ae45482d",
      "discovery_ids": [
        "w43-primary-github-teams-20261023"
      ],
      "evidence_sha256": "764f2e114ddfda40f88abe3e12c052208c1ed8d53f4964b8d63fa0fe8034e864",
      "edition_view_sha256": "02f2644bf4a74ae62b25129d0b2cd1a8b4bb7f543984098a21b201cf13978d03",
      "title": "GitHub Copilot in Teams notifications-to-code",
      "artifact_type": "PRODUCT",
      "evidence_status": "PARTIAL",
      "materiality": "CONTEXT",
      "scope_dimensions": [
        "current relevance"
      ],
      "comparison": {
        "source_count": 2,
        "claim_count": 2,
        "metric_count": 0,
        "limitation_count": 2,
        "unresolved_question_count": 1,
        "contradiction_count": 0,
        "entity_count": 1
      },
      "remaining_boundaries": [
        "Changelog-level only; per-plan rollout unvalidated",
        "Clock from live JSON-LD diagnostic (21:29:58Z); byte-level supplement binding deferred to r4 supplement (existing src-1 only in rehearsal)",
        "plan-and-permission-scope: Plan/permission vendor-stated; independent entitlement check absent."
      ],